<?xml version="1.0" encoding="UTF-8"?>
<!--
To change this license header, choose License Headers in Project Properties.
To change this template file, choose Tools | Templates
and open the template in the editor.
-->


<Respuesta
    xmlns:xsi='http://www.w3.org/2001/XMLSchema-instance'
    xsi:noNamespaceSchemaLocation='RespuestaPacket.xsd'
    Secuencia="3"
    Peso="0"
    >
    <Termino>
        <Nombre></Nombre>
        <Tipo></Tipo>
        <Accion></Accion>
        <ErrorAccion></ErrorAccion>
    </Termino>
    <Termino>
        <Nombre></Nombre>
        <Tipo></Tipo>
        <Accion></Accion>
        <ErrorAccion></ErrorAccion>
        <Peso></Peso>
    </Termino>
    <Termino>
        <Nombre></Nombre>
        <Tipo></Tipo>
        <Accion></Accion>
        <ErrorAccion></ErrorAccion>
        <Peso></Peso>
    </Termino>
    <Termino>
        <Nombre></Nombre>
        <Tipo></Tipo>
        <Accion></Accion>
        <ErrorAccion></ErrorAccion>
        <Peso></Peso>
    </Termino>

</Respuesta>
